timestamp,src_ip,src_host,dst_ip,dst_host,user,event_type,process,port,protocol,severity,description,alert_score,matched_rules
2026-07-01T10:00:00,,,10.0.2.11,ws-finance-01,j.smith,process_creation,invoice_march.exe.scr,,,high,Suspicious double-extension executable launched from email attachment,6,Double-extension filename suggests malware disguise
2026-07-01T10:03:00,10.0.2.11,ws-finance-01,10.0.0.1,edge-firewall,j.smith,network_connection,invoice_march.exe.scr,443,tcp,high,Beacon-like outbound connection to unfamiliar external host (C2 check-in),6,Double-extension filename suggests malware disguise
2026-07-01T10:15:00,10.0.2.11,ws-finance-01,10.0.2.12,ws-hr-02,j.smith,smb_session,invoice_march.exe.scr,445,tcp,medium,SMB session established to shared folder on ws-hr-02,6,Double-extension filename suggests malware disguise
2026-07-01T10:19:00,10.0.2.11,ws-finance-01,10.0.2.12,ws-hr-02,j.smith,remote_process_creation,svchost32.exe,445,tcp,high,Remote process creation on ws-hr-02 originating from ws-finance-01,7,A program was started remotely on another computer (spreading)
2026-07-01T10:27:00,10.0.2.12,ws-hr-02,,,SYSTEM,credential_access,lsass_dump.exe,,,critical,LSASS memory access consistent with credential dumping,17,Direct credential-theft event (reading passwords from memory) | Process name matches a known credential-theft tool
2026-07-01T10:33:00,10.0.2.12,ws-hr-02,10.0.3.5,domain-controller,a.patel,kerberos_auth,lsass_dump.exe,88,tcp,critical,Anomalous Kerberos ticket request using a.patel's credentials,15,Process name matches a known credential-theft tool | Suspicious login-ticket request
2026-07-01T10:43:00,10.0.3.5,domain-controller,10.0.3.20,db-primary,svc_backup,service_account_login,psexec.exe,445,tcp,critical,Service account used interactively from domain controller,15,Process name matches a known network-spreading tool | A service account was used interactively (it normally shouldn't be)
2026-07-01T10:58:00,10.0.3.20,db-primary,,,svc_backup,large_data_transfer,curl.exe,443,tcp,critical,Large outbound data transfer (2.3 GB) to external IP,9,Large amount of data leaving the network (possible theft)
